{
  "$schema": "https://links.moss.land/ecosystem-registry.schema.json",
  "version": "1.1.1",
  "generatedAt": "2026-08-21T00:00:00+09:00",
  "lifecycleReviewedAt": "2026-09-30T06:40:00Z",
  "owner": "mossland",
  "registry": "https://links.moss.land/",
  "description": "Mossland Verified Links — the official directory of verified Mossland domains, ecosystem apps, labs, official channels, and third-party market references. Anything not listed here should be treated as unofficial.",
  "tiers": {
    "official": "Mossland 공식 도메인 / Official Mossland domain",
    "official_beta": "운영 중인 공식 베타 / Official service in open beta",
    "registry": "공식 링크 모음 / The verified-links registry itself",
    "intelligence": "AI 생성 분석 / AI-generated intelligence",
    "showcase": "세계관·체험 쇼케이스 / Worldbuilding & experience showcase",
    "world": "Mossverse 가상세계 / Mossverse virtual world",
    "runtime": "실행 앱 / World runtime app",
    "labs": "실험 — 공식 제품·거버넌스 아님 / Experimental, not an official product or governance",
    "developer": "개발자 리소스 / Developer resource",
    "channel": "커뮤니티 채널 / Community channel (off-domain)",
    "third_party": "제3자 — Mossland 미검증 / Third-party, not verified by Mossland"
  },
  "statuses": {
    "operational": "정상 운영",
    "degraded": "일부 장애",
    "beta": "베타",
    "paused": "일시 중단",
    "offline": "오프라인",
    "deprecated": "지원 종료"
  },
  "rubricVersion": "1.1.0",
  "rubric": {
    "note": "The editorial rubric of record: how a service's fields map to the trust chip shown on the page, and what each Passport stampClass signifies. Versioned separately from `version` (which versions this document's contents) so that a change in classification *meaning* is visible to consumers even when no entry changed. build/generate.mjs derives both the chip and the on-page legend from this object, so the rendered page cannot drift from the declared rubric. See assurance/RUBRIC.md for the changelog and the version-bump rules.",
    "chips": {
      "precedence": [
        {
          "chip": "자료",
          "when": {
            "artifact": true
          }
        },
        {
          "chip": "실험",
          "when": {
            "anyOf": [
              {
                "chipOverride": true
              },
              {
                "tier": "labs"
              }
            ]
          }
        },
        {
          "chip": "제3자",
          "when": {
            "anyOf": [
              {
                "owner": "third-party"
              },
              {
                "tier": "third_party"
              }
            ]
          }
        },
        {
          "chip": "쇼케이스",
          "when": {
            "tier": "showcase"
          }
        },
        {
          "chip": "인텔리전스",
          "when": {
            "tier": "intelligence"
          }
        },
        {
          "chip": "베타",
          "when": {
            "anyOf": [
              {
                "tier": "official_beta"
              },
              {
                "status": "beta"
              }
            ]
          }
        },
        {
          "chip": "공식",
          "when": "default"
        }
      ],
      "legendOrder": [
        "공식",
        "베타",
        "인텔리전스",
        "쇼케이스",
        "실험",
        "제3자",
        "자료"
      ],
      "definitions": {
        "공식": {
          "class": "chip",
          "aria": "공식 · 검증된 Mossland 링크",
          "ko": "Mossland 공식·검증 도메인과 채널",
          "en": "Verified Mossland domains and channels"
        },
        "베타": {
          "class": "chip beta",
          "aria": "베타 · 운영 중인 공식 베타",
          "ko": "운영 중인 공식 베타",
          "en": "Official service in open beta"
        },
        "인텔리전스": {
          "class": "chip intel",
          "aria": "인텔리전스 · 검증된 Mossland AI 분석·데이터",
          "ko": "Mossland AI 분석·데이터 서비스",
          "en": "Mossland AI intelligence & data"
        },
        "쇼케이스": {
          "class": "chip show",
          "aria": "쇼케이스 · 검증된 Mossland 체험형 데모",
          "ko": "체험형 데모·월드 쇼케이스",
          "en": "Experiential demo & world showcase"
        },
        "실험": {
          "class": "chip lab",
          "aria": "실험 · 아직 완성된 공식 제품 아님",
          "ko": "아직 완성된 공식 제품 아님",
          "en": "Experimental, not a finished official product"
        },
        "제3자": {
          "class": "chip third",
          "aria": "제3자 · Mossland 미검증",
          "ko": "Mossland 미검증 외부 링크",
          "en": "Third-party, not verified by Mossland"
        },
        "자료": {
          "class": "chip muted",
          "aria": "자료 · 개발자 데이터 파일",
          "ko": "개발자·데이터 파일",
          "en": "Developer & data files"
        }
      }
    },
    "lifecycle": {
      "note": "MIP-1 (Mossland DAO, agora.moss.land) — 공개 서비스·저장소 생명주기 정책. The lifecycle axis records the maintenance promise a service carries; `status` separately records observed availability at a point in time. Article 1 scopes the obligation to public *.moss.land services and deployment-linked public repositories, so out-of-scope entries (third-party markets, off-domain channels, data artifacts) carry no lifecycle. Article 4 makes this registry the single source of truth for these states, reviewed monthly.",
      "order": [
        "core",
        "beta",
        "lab",
        "archive"
      ],
      "unstaffedCap": "lab",
      "unstaffedNote": "MIP-1 Article 3 — a service without a secondMaintainer is capped at `unstaffedCap`. Holding it above that cap is an exception and requires `lifecycleReason`.",
      "states": {
        "core": {
          "ko": "상시 운영",
          "en": "Always-on",
          "promiseKo": "담당자·부담당자 지정 · 장애 대응 · 변경은 예고 후",
          "promise": "Maintainer and second maintainer, both with deploy and recovery rights; incident response; changes pre-announced",
          "requires": [
            "maintainer",
            "secondMaintainer"
          ]
        },
        "beta": {
          "ko": "운영 중, 변동 가능",
          "en": "Running, subject to change",
          "promiseKo": "담당자 지정 · 기능·데이터가 바뀔 수 있음",
          "promise": "Maintainer assigned; features and data may change",
          "requires": [
            "maintainer"
          ]
        },
        "lab": {
          "ko": "실험, best-effort",
          "en": "Experimental, best-effort",
          "promiseKo": "예고 없이 변경·중단될 수 있음",
          "promise": "May change or stop without notice",
          "requires": []
        },
        "archive": {
          "ko": "종료·보존",
          "en": "Ended, preserved",
          "promiseKo": "신규 개발 중단 · 기록은 읽기 전용으로 보존",
          "promise": "Development ended; the record is preserved read-only. Archive is not deletion — removing a domain, its data, or its repository requires its own proposal.",
          "requires": [
            "lifecycleReason"
          ]
        }
      }
    },
    "stampClasses": {
      "core": {
        "meaning": "identity / holder",
        "ko": "신원·홀더"
      },
      "governance": {
        "meaning": "binding decision acts",
        "ko": "구속력 있는 의사결정 행위"
      },
      "participation": {
        "meaning": "recurring community activity",
        "ko": "반복적 커뮤니티 활동"
      },
      "connect": {
        "meaning": "lightweight verified-domain visit",
        "ko": "검증된 도메인 방문(경량)"
      },
      "lab": {
        "meaning": "experimental observer",
        "ko": "실험 관찰자"
      },
      "showcase": {
        "meaning": "experience visit",
        "ko": "체험 방문"
      }
    },
    "stampWeighting": "Not defined here. This registry declares what each stampClass signifies, not a numeric weight; the weighting policy belongs to Passport. rubricVersion is the signal that tells a consumer these meanings changed."
  },
  "services": [
    {
      "id": "moss",
      "name": "Mossland",
      "domain": "www.moss.land",
      "url": "https://www.moss.land/",
      "tier": "official",
      "label": "Official",
      "labelKo": "공식 홈페이지",
      "section": "official",
      "status": "operational",
      "statusUrl": "https://moss.land/api/health",
      "pipeline": "stream",
      "lifecycle": "beta",
      "maintainer": "MosslandOpenDevs",
      "lifecycleReason": "MIP-1 Annex A Core candidate, published as Beta per Annex A's own rule: second maintainer not yet designated (Art. 3 exception, recorded here). Promote to core once maintainer and secondMaintainer are both named individuals with deploy and recovery rights.",
      "passportEligible": false,
      "stampType": null,
      "stampClass": null,
      "sourceOfTruth": null,
      "lastDataAt": null,
      "owner": "mossland",
      "hidden": false
    },
    {
      "id": "disclosure",
      "name": "Disclosure",
      "domain": "disclosure.moss.land",
      "url": "https://disclosure.moss.land/",
      "tier": "official",
      "label": "Official Records",
      "labelKo": "공식 공시",
      "section": "official",
      "status": "operational",
      "statusUrl": "https://disclosure.moss.land/api/health",
      "pipeline": "batch",
      "lifecycle": "beta",
      "maintainer": "MosslandOpenDevs",
      "lifecycleReason": "MIP-1 Annex A Core candidate, published as Beta per Annex A's own rule: second maintainer not yet designated (Art. 3 exception, recorded here). Promote to core once maintainer and secondMaintainer are both named individuals with deploy and recovery rights.",
      "passportEligible": true,
      "stampType": "disclosure_reader",
      "stampClass": "participation",
      "sourceOfTruth": null,
      "lastDataAt": null,
      "owner": "mossland",
      "hidden": false
    },
    {
      "id": "passport",
      "name": "Passport",
      "domain": "passport.moss.land",
      "url": "https://passport.moss.land/",
      "tier": "official_beta",
      "label": "Wallet verification · participation record",
      "labelKo": "지갑 인증·참여 증명",
      "section": "participation",
      "status": "beta",
      "statusUrl": "https://passport.moss.land/api/health",
      "pipeline": "batch",
      "lifecycle": "beta",